{
  "manifestVersion": 1,
  "sdkVersion": "1.0.0-alpha.1",
  "sourceRevision": "bbfbb86cb66efa95cd83b9daf13f528e7a8ea77c",
  "protocolFixtureDigest": "e3803e1e7774b9a7513d1c8059a7ea6ee30bf37d91a8b6662bf2f6fb06dd9639",
  "firmwareCompatibility": {
    "minimum": "1.0.0",
    "maximum": "1.0.17",
    "baselineRevision": "8b175a89374c9833bdaa67fe73ada6672618e5f7"
  },
  "artifacts": [
    {
      "name": "bota-device-sdk-core",
      "ecosystem": "cargo",
      "version": "1.0.0-alpha.1",
      "checksumSha256": "0000000000000000000000000000000000000000000000000000000000000000",
      "capabilities": ["protocol_core"]
    }
  ]
}
